{
  "$schema": "https://tinyzkp.com/schemas/tinyzkp-examples.schema.json",
  "name": "TinyZKP Example Receipt Workflows",
  "url": "https://tinyzkp.com/examples",
  "generated_at": "2026-06-24",
  "summary": "Concrete example workflows that map TinyZKP proof receipts to agent actions, API mutations, audit checkpoints, reserves, inventory, and long-trace sizing.",
  "boundary": {
    "live_template": "accumulator_step",
    "claim": "initial + sum(deltas) = final",
    "static_examples_include_proof_bytes": false,
    "customer_case_studies": false,
    "guidance": "Examples are illustrative public statements. Generate a live receipt in the playground or API before using an example as evidence."
  },
  "examples": [
    {
      "id": "agent-approval",
      "title": "Agent approval counter",
      "audience": "Agent builders",
      "workflow": "An agent supervisor tracks approved actions during a session and returns a receipt with the final checkpoint.",
      "statement": { "template_id": "accumulator_step", "initial": 42, "deltas": [3, 2, 5], "final": 52 },
      "proves": [
        "The public approval counter advanced from 42 to 52 by the declared increments.",
        "A downstream service can verify without replaying the agent transcript."
      ],
      "does_not_prove": [
        "That each real-world approval was correct.",
        "That private approval details stayed hidden."
      ],
      "try_url": "https://tinyzkp.com/try?initial=42&deltas=3,2,5&example=agent-approval",
      "related": ["https://tinyzkp.com/agents", "https://tinyzkp.com/mcp"]
    },
    {
      "id": "api-mutation",
      "title": "Customer-visible API mutation",
      "audience": "API and SaaS teams",
      "workflow": "A SaaS API attaches a receipt after a quota, seat, or balance mutation so the customer can verify the returned state.",
      "statement": { "template_id": "accumulator_step", "initial": 700, "deltas": [25, 25, 50], "final": 800 },
      "proves": [
        "The public account checkpoint moved from 700 to 800 by the declared mutation batch.",
        "The receipt can travel with the API response."
      ],
      "does_not_prove": [
        "That the quota policy was fair.",
        "That hidden customer data was never processed elsewhere."
      ],
      "try_url": "https://tinyzkp.com/try?initial=700&deltas=25,25,50&example=api-mutation",
      "related": ["https://tinyzkp.com/recipes", "https://tinyzkp.com/integrations"]
    },
    {
      "id": "audit-checkpoint",
      "title": "Audit-log checkpoint",
      "audience": "Audit and compliance teams",
      "workflow": "An audit trail rolls many public event weights into a compact checkpoint that a reviewer can verify later.",
      "statement": { "template_id": "accumulator_step", "initial": 800, "deltas": [11, 17, 19, 23], "final": 870 },
      "proves": [
        "The published checkpoint advanced by the declared public increments.",
        "An auditor can verify the arithmetic transition without replaying the full system."
      ],
      "does_not_prove": [
        "That every source event was legitimate.",
        "That omitted events do not exist."
      ],
      "try_url": "https://tinyzkp.com/try?initial=800&deltas=11,17,19,23&example=audit-checkpoint",
      "related": ["https://tinyzkp.com/use-cases/tamper-evident-audit-log", "https://tinyzkp.com/receipts"]
    },
    {
      "id": "reserve-update",
      "title": "Reserve aggregate update",
      "audience": "Finance and attestation teams",
      "workflow": "A finance workflow publishes a reserve or liability aggregate update and keeps the attestation boundary explicit.",
      "statement": { "template_id": "accumulator_step", "initial": 500, "deltas": [60, 40, 20], "final": 620 },
      "proves": [
        "The public aggregate moved from 500 to 620 by the declared updates.",
        "The receipt can sit beside a reserve or liability checkpoint."
      ],
      "does_not_prove": [
        "Custody, asset ownership, or external bank balances by itself.",
        "Private-input proof-of-solvency."
      ],
      "try_url": "https://tinyzkp.com/try?initial=500&deltas=60,40,20&example=reserve-update",
      "related": ["https://tinyzkp.com/use-cases/proof-of-reserves-attestation", "https://tinyzkp.com/trust"]
    },
    {
      "id": "inventory-reconciliation",
      "title": "Inventory reconciliation",
      "audience": "Operations teams",
      "workflow": "An operations system turns a batch of inventory adjustments into a receipt-bearing reconciliation checkpoint.",
      "statement": { "template_id": "accumulator_step", "initial": 310, "deltas": [7, 8, 15, 10], "final": 350 },
      "proves": [
        "The published inventory accumulator advanced by the declared adjustment batch.",
        "Another system can verify the checkpoint without database access."
      ],
      "does_not_prove": [
        "That physical inventory exists.",
        "That the source ERP has no other records."
      ],
      "try_url": "https://tinyzkp.com/try?initial=310&deltas=7,8,15,10&example=inventory-reconciliation",
      "related": ["https://tinyzkp.com/integrations", "https://tinyzkp.com/evaluation"]
    },
    {
      "id": "long-trace-sizing",
      "title": "Long trace sizing sample",
      "audience": "Infrastructure and audit teams",
      "workflow": "A large backfill starts with a small public statement, then moves to Compute once the trace length makes prover operations the bottleneck.",
      "statement": { "template_id": "accumulator_step", "initial": 900, "deltas": [10, 10, 10, 10, 10, 10, 10, 10, 10, 10], "final": 1000 },
      "proves": [
        "The small sample statement is internally consistent.",
        "The same workflow shape can be priced and reviewed for longer traces."
      ],
      "does_not_prove": [
        "That every future long trace fits latency limits.",
        "That custom zkVM or zkML proving is generally available."
      ],
      "try_url": "https://tinyzkp.com/try?initial=900&deltas=10,10,10,10,10,10,10,10,10,10&example=long-trace-sizing",
      "related": ["https://tinyzkp.com/compute", "https://tinyzkp.com/calculator"]
    }
  ],
  "evaluation_use": [
    "Pick the example closest to the target workflow.",
    "Generate the live receipt in the playground.",
    "Copy the verifier result into the evaluation packet.",
    "Replace the sample statement with real public parameters before production.",
    "Use pilot review when the workflow is custom, private-input, on-chain, restricted-runtime, or long-trace sensitive."
  ],
  "links": {
    "examples_page": "https://tinyzkp.com/examples",
    "examples_metadata": "https://tinyzkp.com/examples.json",
    "examples_schema": "https://tinyzkp.com/schemas/tinyzkp-examples.schema.json",
    "try": "https://tinyzkp.com/try",
    "verify": "https://tinyzkp.com/verify",
    "receipts": "https://tinyzkp.com/receipts",
    "templates": "https://tinyzkp.com/templates",
    "agent_policy": "https://tinyzkp.com/agent-policy",
    "agent_policy_metadata": "https://tinyzkp.com/agent-policy.json",
    "agent_platforms": "https://tinyzkp.com/agent-platforms",
    "platform_rollout": "https://tinyzkp.com/platform-rollout",
    "platform_rollout_metadata": "https://tinyzkp.com/platform-rollout.json",
    "evaluation": "https://tinyzkp.com/evaluation",
    "pricing": "https://tinyzkp.com/pricing",
    "calculator": "https://tinyzkp.com/calculator",
    "pilot_program": "https://tinyzkp.com/pilot",
    "trust_center": "https://tinyzkp.com/trust"
  }
}
